<?xml version="1.0"?>
<!-- List of HTML elements/attributes used by HTML Tag Inspector -->
<!-- Copyright (c) 2001, InterSystems Corp. ALL RIGHTS RESERVED -->
<!DOCTYPE elementlist SYSTEM "htmltags.dtd">
<elementlist>
	<!-- FORMATTING TAGS -->
	<!-- SPAN TAG -->
	<element ename="SPAN" edesc="SPAN Tag">
		<attrs>
&attrs;
&csptext;
</attrs>
	</element>
	<!-- SUP TAG -->
	<element ename="SUP" edesc="Superscript Tag">
		<attrs>
&attrs;
</attrs>
	</element>
	<!-- SUB TAG -->
	<element ename="SUB" edesc="Subscript Tag">
		<attrs>
&attrs;
</attrs>
	</element>
	<!-- BDO TAG -->
	<element ename="BDO" edesc="Overrides bidirectional algorithms for content display">
		<attrs>
&attrs;
<attr name="dir" type="enum" enum="rtl|ltr" desc="Text direction."/>
			<attr name="lang" type="string" desc="Language."/>
		</attrs>
	</element>
	<!-- B TAG -->
	<element ename="B" edesc="Boldface Tag">
		<attrs>
&attrs;
</attrs>
	</element>
	<!-- I TAG -->
	<element ename="I" edesc="Italics Tag">
		<attrs>
&attrs;
</attrs>
	</element>
	<!-- STRONG TAG -->
	<element ename="STRONG" edesc="Strong Tag">
		<attrs>
&attrs;
</attrs>
	</element>
	<!-- EM TAG -->
	<element ename="EM" edesc="Emphasis Tag">
		<attrs>
&attrs;
</attrs>
	</element>
	<!-- BASEFONT TAG -->
	<element ename="BASEFONT" edesc="base font size" empty="1">
		<attrs>
			<attr name="id" type="string" desc="Id."/>
			<attr name="size" type="string" desc="Base font size."/>
			<attr name="color" type="color" desc="Text color."/>
			<attr name="face" type="string" desc="Comma-separated list of font names."/>
		</attrs>
	</element>
	<!-- FONT TAG -->
	<element ename="FONT" edesc="Local change to font">
		<attrs>
&attrs;
<attr name="size" type="string" desc="Font size."/>
			<attr name="color" type="color" desc="Text color."/>
			<attr name="face" type="string" desc="Comma-separated list of font names."/>
		</attrs>
	</element>
	<!-- LIST TAGS -->
	<!-- FLOW TAGS -->
	<!-- BR TAG -->
	<element ename="BR" edesc="Forced line break" empty="1">
		<attrs>
&attrs;
<attr name="clear" type="enum" enum="left|all|right|none" desc="Control of text flow."/>
		</attrs>
	</element>
	<!-- NOBR TAG -->
	<element ename="NOBR" edesc="Define a non-breaking region" empty="1">
		<attrs>
</attrs>
	</element>
	<!-- PRE TAG -->
	<element ename="PRE" edesc="Define a region with no formatting">
		<attrs>
&attrs;
<attr name="width" type="number" desc="Width."/>
		</attrs>
	</element>
	<!-- HR TAG -->
	<element ename="HR" edesc="Horizontal line" empty="1">
		<attrs>
&attrs;
<attr name="align" type="enum" enum="left|right|center" desc="Alignment."/>
			<attr name="noshade" type="boolean" desc="No shading."/>
			<attr name="size" type="number" desc="Size."/>
			<attr name="width" type="number" desc="Override width."/>
		</attrs>
	</element>
	<!-- P TAG -->
	<element ename="P" edesc="Paragraph">
		<attrs>
&attrs;
<attr name="align" type="enum" enum="left|center|right|justify" desc="Alignment."/>
		</attrs>
	</element>
	<!-- H1 TAG -->
	<element ename="H1" edesc="Heading 1">
		<attrs>
&attrs;
<attr name="align" type="enum" enum="left|center|right|justify" desc="Alignment."/>
		</attrs>
	</element>
	<!-- H2 TAG -->
	<element ename="H2" edesc="Heading 2">
		<attrs>
&attrs;
<attr name="align" type="enum" enum="left|center|right|justify" desc="Alignment."/>
		</attrs>
	</element>
	<!-- H3 TAG -->
	<element ename="H3" edesc="Heading 3">
		<attrs>
&attrs;
<attr name="align" type="enum" enum="left|center|right|justify" desc="Alignment."/>
		</attrs>
	</element>
	<!-- H4 TAG -->
	<element ename="H4" edesc="Heading 4">
		<attrs>
&attrs;
<attr name="align" type="enum" enum="left|center|right|justify" desc="Alignment."/>
		</attrs>
	</element>
	<!-- H5 TAG -->
	<element ename="H5" edesc="Heading 5">
		<attrs>
&attrs;
<attr name="align" type="enum" enum="left|center|right|justify" desc="Alignment."/>
		</attrs>
	</element>
	<!-- H6 TAG -->
	<element ename="H6" edesc="Heading 6">
		<attrs>
&attrs;
<attr name="align" type="enum" enum="left|center|right|justify" desc="Alignment."/>
		</attrs>
	</element>
	<!-- Q TAG -->
	<element ename="Q" edesc="inline quotes">
		<attrs>
&attrs;
<attr name="cite" type="uri" desc="URI for source document or message."/>
		</attrs>
	</element>
	<!-- BLOCKQUOTE TAG -->
	<element ename="BLOCKQUOTE" edesc="long quotation">
		<attrs>
&attrs;
<attr name="cite" type="uri" desc="URI for source document or message."/>
		</attrs>
	</element>
	<!-- INS TAG -->
	<element ename="INS" edesc="inserted text">
		<attrs>
&attrs;
<attr name="cite" type="uri" desc="Reason for change."/>
			<attr name="datetime" type="datetime" desc="Date and time of the change."/>
		</attrs>
	</element>
	<!-- DEL TAG -->
	<element ename="DEL" edesc="deleted text">
		<attrs>
&attrs;
<attr name="cite" type="uri" desc="Reason for change."/>
			<attr name="datetime" type="datetime" desc="Date and time of the change."/>
		</attrs>
	</element>
	<!-- ANCHOR TAG -->
	<element ename="A" edesc="Anchor Tag">
		<attrs>
&attrs;

<attr name="charset" type="string" desc="Char encoding of linked resource."/>
			<attr name="type" type="string" desc="Advisory content type."/>
			<attr name="name" type="string" desc="Named link end."/>
			<attr name="href" type="uri" desc="URI for linked resource."/>
			<attr name="hreflang" type="string" desc="Language code."/>
			<attr name="target" type="string" desc="Render in this frame."/>
			<attr name="rel" type="string" desc="Forward link types."/>
			<attr name="rev" type="string" desc="Reverse link types."/>
			<attr name="accesskey" type="char" desc="Accessibility key character."/>
			<attr name="shape" type="string" desc="For use with client-side image maps."/>
			<attr name="coords" type="string" desc="For use with client-side image maps."/>
			<attr name="tabindex" type="number" desc="Position in tabbing order."/>
			<attr name="onfocus" cat="Event" type="script" desc="The element got the focus."/>
			<attr name="onblur" cat="Event" type="script" desc="The element lost the focus."/>
		</attrs>
	</element>
	<!-- UL TAG -->
	<element ename="UL" edesc="Unordered List Tag">
		<attrs>
&attrs;
</attrs>
	</element>
	<!-- OL TAG -->
	<element ename="OL" edesc="Ordered List Tag">
		<attrs>
&attrs;
<attr name="start" type="number" desc="Starting value for list."/>
			<attr name="type" type="enum" enumlist="A|a|I|i|1" desc="Numbering style for list."/>
		</attrs>
	</element>
	<!-- LI TAG -->
	<element ename="LI" edesc="List Item Tag">
		<attrs>
&attrs;
<attr name="type" type="enum" enumlist="A|a|I|i|1" desc="Numbering style for list item."/>
			<attr name="value" type="string" desc="Value for list item."/>
		</attrs>
	</element>
	<!-- STRUCTURE TAGS -->
	<!-- HTML TAG -->
	<element ename="HTML" edesc="Defines a complete HTML document.">
		<attrs>
&i18n;
</attrs>
	</element>
	<!-- HEAD TAG -->
	<element ename="HEAD" edesc="Defines an HTML document header.">
		<attrs>
&i18n;
</attrs>
	</element>
	<!-- META TAG -->
	<element ename="META" edesc="Supply additional information about a document." empty="1">
		<description>
Supplies information that a HTTP-server can use to generate extra HTTP headers, from the HTML data.
CSP supports http-equiv=content-type and http-equiv-expires.
</description>
		<attrs>
&i18n;

<attr name="http-equiv" type="enum" enum="content-type|expires|refresh|set-cookie" desc="Type of information supplied."/>
			<attr name="name" type="string" desc="Name of the meta data being defined."/>
			<attr name="content" type="string" desc="The value of the meta data for http-equiv or name."/>
			<attr name="scheme" type="string" desc="The format of the meta data for name."/>
		</attrs>
	</element>
	<!-- TITLE TAG -->
	<element ename="TITLE" edesc="Defines an HTML document title.">
		<attrs>
&i18n;
</attrs>
	</element>
	<!-- BODY TAG -->
	<element ename="BODY" edesc="Body Tag">
		<attrs>
&attrs;

<attr name="bgcolor" type="color" desc="Document background color."/>
			<attr name="text" type="color" desc="Document text color."/>
			<attr name="link" type="color" desc="Color of links."/>
			<attr name="vlink" type="color" desc="Color of visited links."/>
			<attr name="alink" type="color" desc="Color of selected links."/>
			<attr name="background" type="uri" desc="Texture tile for document background."/>
			<attr name="onload" cat="Event" type="script" desc="The document has been loaded."/>
			<attr name="onunload" cat="Event" type="script" desc="The document has been removed."/>
		</attrs>
	</element>
	<!-- ADDRESS TAG -->
	<element ename="ADDRESS" edesc="Author information">
		<attrs>
&attrs;
</attrs>
	</element>
	<!-- DIV TAG -->
	<element ename="DIV" edesc="DIV Tag">
		<attrs>
&attrs;
&csptext;
<attr name="align" type="enum" enum="&align;" desc="Text alignment."/>
		</attrs>
	</element>
	<!-- CENTER TAG -->
	<element ename="CENTER" edesc="Centered block">
		<attrs>
&attrs;
</attrs>
	</element>
	<!-- IMAGE MAPS -->
	<!-- MAP -->
	<element ename="MAP" edesc="Client-side image map">
		<attrs>
&attrs;
<attr name="name" type="string" desc="Name of map."/>
		</attrs>
	</element>
	<!-- AREA -->
	<element ename="AREA" edesc="Client-side image map area">
		<attrs>
&attrs;
<attr name="name" type="string" desc="name of map"/>
			<attr name="shape" type="string" desc="For use with client-side image maps."/>
			<attr name="coords" type="string" desc="For use with client-side image maps."/>
			<attr name="href" type="uri" desc="URI for linked resource."/>
			<attr name="target" type="string" desc="Render in this frame."/>
			<attr name="nohref" type="boolean" desc="This region has no action."/>
			<attr name="alt" type="string" desc="Short description."/>
			<attr name="tabindex" type="number" desc="Position in tabbing order."/>
			<attr name="accesskey" type="char" desc="Accessibility key character."/>
			<attr name="onfocus" cat="Event" type="script" desc="The element got the focus."/>
			<attr name="onblur" cat="Event" type="script" desc="The element lost the focus."/>
		</attrs>
	</element>
	<!-- THE LINK TAG -->